ID,BirthYear,DeathYear,Region,Civilization/Tradition,Era,School/Movement,CoreTeachings,HistoricalContext,PrimaryTopics,MetaphysicalStance,EpistemologicalStance,EthicalOrientation,PoliticalOrientation,ReligiousOrientation,KeyWorks,Tags
P035,1806,1873.0,Europe,Modern European,19th Century,Utilitarianism;Liberalism,"Mill refined utilitarianism by emphasizing qualitative differences in pleasures and defending individual liberty as instrumental to happiness and human development. In On Liberty, he argued for extensive freedom of thought, expression, and lifestyle, constrained mainly by the harm principle. He supported women’s equality, representative government, and experiments in living as ways to advance both individual and social progress. His work integrates a consequentialist ethics with a robust defense of liberal rights and democratic institutions.","Mill was born in London, the son of James Mill, and was educated rigorously from a young age within a Benthamite circle. He worked for the East India Company and later served as a Member of Parliament, engaging directly in British political life. Living amid industrialization and empire, he confronted issues of colonialism, democratic reform, and women’s rights in the mid-19th century.",Ethics;Political Philosophy;Social Theory,Naturalistic Realism; Utilitarian Framework,Empiricism; Refined Utilitarian Reasoning,Utilitarianism; Perfectionist Elements (Higher Pleasures),Liberal; Democratic; Reformist,Secular with Unitarian Background; Religious Liberalism,Utilitarianism; On Liberty; Considerations on Representative Government; The Subjection of Women,Harm principle;Higher and lower pleasures;Victorian liberalism
P036,1813,1855.0,Europe,Modern European,19th Century,Existentialism (forerunner);Christian Philosophy,"Kierkegaard emphasized individual existence, subjectivity, and the leap of faith over abstract system-building. He criticized both Hegelian philosophy and established Christendom for neglecting authentic, passionate commitment to God. Through pseudonymous works, he explored stages of life—the aesthetic, ethical, and religious—and described anxiety, despair, and paradox as central to human existence. His thought laid the groundwork for existentialism and influenced later theology and philosophy of religion.","Born in Copenhagen to a devout Lutheran family, Kierkegaard lived in a small but intellectually active Danish society. He wrote amid the dominance of Hegelianism in academic philosophy and a complacent state church in Denmark. Personally marked by family tragedies, a broken engagement, and persistent illness, he conducted a one-man campaign against what he saw as the superficiality of his age.",Ethics;Philosophy of Religion;Existentialism;Aesthetics,Christian Existentialism; Anti-systematic,Subjective Knowledge; Faith beyond Reason,Existential Ethics; Individual Responsibility,Critical of Established Church; Not Systematically Political,Lutheran Christian (deeply critical of Christendom),Either/Or; Fear and Trembling; The Sickness Unto Death; Concluding Unscientific Postscript,Existentialism precursor;Leap of faith;Danish Golden Age
P037,1844,1900.0,Europe,Modern European,19th Century,Genealogical Critique;Existentialism (influence),"Nietzsche launched a radical critique of traditional morality, religion, and metaphysics, interpreting them as expressions of life-denying ressentiment and will to power. He proposed the revaluation of all values, the ideal of the Übermensch, and the affirmation of eternal recurrence as tests of life-affirmation. Rejecting absolute truths, he employed genealogy to uncover the historical and psychological origins of moral concepts. His style and ideas profoundly influenced existentialism, post-structuralism, and cultural criticism.","Nietzsche was born in Röcken, Prussia, trained as a classical philologist, and became a professor at Basel at a young age before resigning due to health problems. He lived a largely solitary, itinerant life in Switzerland, Italy, and Germany, writing during the late 19th century as European nationalism, secularization, and mass culture expanded. After a mental collapse in 1889, his works were edited and sometimes distorted by others, including his sister, contributing to later misappropriations.",Ethics;Metaphysics;Philosophy of Religion;Aesthetics;Social Critique,Anti-metaphysical; Perspectivism; Will to Power,Genealogical Method; Critique of Truth; Psychological Insight,Beyond Good and Evil; Ethics of Self-Creation,Critical of Democracy and Herd Morality; Complex views on Aristocracy and Power,Lutheran background; Atheist; Anti-Christian,Thus Spoke Zarathustra; Beyond Good and Evil; On the Genealogy of Morals; The Gay Science,Death of God;Will to power;Übermensch
P038,1839,1914.0,North America,American,19th Century,Pragmatism,"Peirce founded pragmatism as a theory of meaning, holding that the meaning of a concept lies in its practical effects and conceivable consequences. He developed a sophisticated logic and semiotics, viewing inquiry as a communal, fallibilist process converging toward truth. His metaphysics included categories of firstness, secondness, and thirdness, and he defended a form of objective idealism with evolutionary and probabilistic elements. His work laid foundations for American pragmatism and influenced logic, philosophy of science, and epistemology.","Peirce was born in Cambridge, Massachusetts, the son of a prominent mathematician, and was educated at Harvard. He worked intermittently for the U.S. Coast Survey and as a lecturer but never secured a stable academic career, partly due to personal and institutional difficulties. Writing in the context of post–Civil War America and emerging scientific professionalization, he published much of his work in scattered articles rather than systematic treatises.",Logic;Epistemology;Philosophy of Science;Semiotics;Metaphysics,Objective Idealism; Fallibilism; Scholastic Realism,Pragmatism; Fallibilist Scientific Method,No Systematic Normative Ethics; Emphasis on Intellectual Virtues,"Liberal, but Not Systematically Political",Raised in a Protestant milieu; Heterodox Christian leanings,Collected Papers (posthumous); How to Make Our Ideas Clear; The Fixation of Belief,American pragmatism;Semiotics;Fallibilism
P039,1842,1910.0,North America,American,19th Century,Pragmatism,"James developed a pragmatic theory of truth, evaluating beliefs by their practical consequences and their role in guiding successful action. He emphasized the fluid, pluralistic character of experience and defended the legitimacy of religious and moral faith where evidence underdetermines options. In psychology and philosophy of mind, he described consciousness as a ‘stream’ and rejected rigid introspective atomism. His work popularized pragmatism and integrated philosophy with psychology, religious studies, and everyday concerns.","Born in New York City to an intellectually active family, James studied medicine and taught at Harvard, becoming a central figure in American academic life. He lived during the late 19th and early 20th centuries, when psychology was emerging as a distinct discipline and religious belief was under scrutiny from science. His lectures and writings reached both scholarly and general audiences, shaping American thought on belief, will, and experience.",Epistemology;Philosophy of Religion;Philosophy of Mind;Psychology;Ethics,Radical Empiricism; Pluralism,Pragmatism; Will to Believe,Pluralistic Ethics; Emphasis on Lived Consequences,Liberal; Individualist; Democratic Sympathies,Raised in a Protestant environment; Religious but anti-dogmatic,The Will to Believe; Pragmatism; The Varieties of Religious Experience; Principles of Psychology,Radical empiricism;Stream of consciousness;American pragmatism
P040,1820,1895.0,Europe,Modern European,19th Century,Marxism,"Engels collaborated with Marx to develop historical materialism and a critique of capitalism, co-authoring foundational texts of Marxist theory. He wrote on the conditions of the working class, the role of family and gender in class society, and the dialectics of nature. After Marx’s death, Engels edited and published volumes II and III of Capital, helping shape the canonical form of Marxism. His work integrates empirical observation of industrial society with a revolutionary socialist framework.","Engels was born in Barmen, Prussia, to a wealthy textile-manufacturing family and worked in his father’s factories in Germany and England. His experiences in Manchester exposed him to harsh working-class conditions, which he documented in sociological detail. Active in revolutionary and socialist movements across Europe, he served as Marx’s close collaborator and financial supporter, living much of his later life in London.",Political Philosophy;Social Theory;Economics;Philosophy of History,Historical Materialism,Empirically Grounded Dialectics,Socialist Ethics; Class Emancipation,Communist; Revolutionary Socialist,Protestant background; Secular; Atheist,"The Condition of the Working Class in England; The Communist Manifesto (with Marx); Anti-Dühring; The Origin of the Family, Private Property and the State",Industrial working class;Engels as collaborator;Dialectics of nature
P041,1872,1970.0,Europe,Modern European,20th Century,Analytic Philosophy,"Russell helped found analytic philosophy by applying formal logic to philosophical problems and rejecting idealism. He developed the theory of descriptions, contributed to the foundations of mathematics with Principia Mathematica, and defended a logical atomist view of reality as composed of simple, knowable facts. He advocated a broadly empiricist epistemology and was critical of metaphysical excess. Beyond technical work, he wrote extensively on ethics, politics, and religion from a secular, often liberal and pacifist standpoint.","Russell was born into an aristocratic British family and educated at Cambridge, participating in the Apostles and later teaching there. He lived through two world wars, publicly opposing World War I and nuclear weapons, which led to political activism and occasional imprisonment. His long life spanned Victorian Britain to the 1960s, and he became a prominent public intellectual as well as a technical philosopher.",Logic;Epistemology;Metaphysics;Philosophy of Language;Ethics;Political Philosophy,Logical Atomism; Pluralistic Realism,Logical Analysis; Empiricism,Consequentialist-Leaning Secular Ethics,Liberal; Democratic Socialist Sympathies; Pacifist Activism,Raised Anglican; Later Agnostic/Atheist,Principia Mathematica (with Whitehead); On Denoting; Our Knowledge of the External World; A History of Western Philosophy,Analytic philosophy founder;Logical atomism;Peace activism
P042,1873,1958.0,Europe,Modern European,20th Century,Analytic Philosophy,"Moore is known for defending common sense against philosophical skepticism and for his work in ethics and analysis. In Principia Ethica, he argued that ‘good’ is a simple, non-natural property known by intuition and criticized the naturalistic fallacy of defining good in terms of natural properties. He promoted a meticulous style of conceptual analysis that helped define early analytic philosophy. His open-question argument and common-sense propositions influenced debates in ethics and epistemology.","Born in London, Moore studied and taught at Cambridge, where he was part of a circle that included Russell and later Wittgenstein. He lived through two world wars, largely focused on academic life and philosophical writing. As editor of Mind and a central figure at Cambridge, he shaped the ethos and methods of early 20th-century analytic philosophy.",Ethics;Epistemology;Metaphysics;Philosophy of Language,Non-natural Moral Realism; Common-Sense Realism,Intuitionism; Conceptual Analysis,Intuitionist Ethics; Non-naturalism about Good,Liberal; Not Systematically Political,Raised Protestant; Later Non-religious,Principia Ethica; A Defense of Common Sense; Proof of an External World,Common sense philosophy;Open-question argument;Cambridge analysis
P043,1889,1951.0,Europe,Modern European,20th Century,Analytic Philosophy (Early and Later),"Wittgenstein’s early work in the Tractatus sought to show the limits of language by analyzing propositions as logical pictures of facts, concluding that what cannot be said clearly must be passed over in silence. His later philosophy, especially in the Philosophical Investigations, rejected this picture theory in favor of understanding meaning as use within language-games and forms of life. He critiqued the idea of a private language and encouraged attending to ordinary linguistic practices to dissolve philosophical confusions. His shifting views profoundly shaped philosophy of language, mind, and methodology in the 20th century.","Born in Vienna to a wealthy industrial family, Wittgenstein studied engineering before turning to logic and philosophy under Russell at Cambridge. He served in World War I, later lived in relative isolation in Austria, and returned to Cambridge as a professor. His life involved periods of intense teaching, ascetic living, and personal turmoil, set against the backdrop of two world wars and the collapse of the Austro-Hungarian Empire.",Philosophy of Language;Logic;Metaphysics;Philosophy of Mind;Epistemology,Logical Atomism (early); Anti-essentialism and Pragmatic Orientation (later),Logical Analysis (early); Ordinary Language and Use (later),No Systematic Normative Ethics; Emphasis on Clarity and Honesty,Generally Apolitical; Personally Anti-authoritarian,Raised Catholic; Deeply Religious Temperament but Heterodox,Tractatus Logico-Philosophicus; Philosophical Investigations; On Certainty; Blue and Brown Books,Language-games;Picture theory;Private language argument
P044,1891,1970.0,Europe,Modern European,20th Century,Logical Positivism,"Carnap was a leading figure in logical positivism, advocating the elimination of metaphysics as meaningless pseudo-statements and the logical reconstruction of scientific language. He distinguished between analytic and synthetic statements and worked to formalize confirmation and probability in science. He aimed to build unified, logically precise languages to express scientific theories and clarify philosophical problems. His work influenced philosophy of science, logic, and the development of analytic philosophy in the 20th century.","Carnap was born in Germany, served in World War I, and studied under Frege and others before joining the Vienna Circle. As Nazism rose, he emigrated to the United States, teaching at universities such as Chicago and UCLA. His career unfolded amid rapid advances in logic, physics, and the institutionalization of analytic philosophy in the Anglo-American world.",Logic;Philosophy of Science;Philosophy of Language;Metaphysics (critique),Logical Empiricism; Deflationary Metaphysics,Logical Empiricism; Verificationism (early); Logical Analysis,No Systematic Normative Ethics; Emphasis on Scientific Rationality,Liberal; Anti-authoritarian; Not Systematically Political,Lutheran background; Later Non-religious,The Logical Structure of the World; Logical Syntax of Language; Meaning and Necessity; Logical Foundations of Probability,Vienna Circle;Logical positivism;Analytic-synthetic distinction
P045,1908,2000.0,North America,American,20th Century,Analytic Philosophy;Naturalized Epistemology,"Quine challenged the analytic-synthetic distinction and argued for a holistic view of knowledge in which statements face experience not individually but as a web. He promoted naturalized epistemology, treating the study of knowledge as continuous with empirical psychology. His work in logic and ontology advocated a sparse, scientifically informed ontology and the criterion ‘to be is to be the value of a bound variable.’ He also defended the indeterminacy of translation, questioning the idea of uniquely determined meanings.","Quine was born in Ohio, studied and later taught at Harvard, and became one of the most influential American philosophers of the mid-20th century. He engaged closely with the logical empiricist tradition while also critiquing and transforming it. Living through World War II and the Cold War, he participated in wartime codebreaking and worked in an era of growing ties between philosophy and formal sciences.",Epistemology;Metaphysics;Logic;Philosophy of Language;Philosophy of Science,Naturalism; Ontological Relativism (to Theory),Empiricism; Holism; Naturalized Epistemology,No Systematic Normative Ethics; Scientific Pragmatism,Liberal; Not Systematically Political,Raised in a Protestant environment; Later Non-religious,Two Dogmas of Empiricism; Word and Object; Ontological Relativity and Other Essays,Two dogmas;Web of belief;Naturalized epistemology
P046,1900,1976.0,Europe,Modern European,20th Century,Ordinary Language Philosophy,"Ryle criticized Cartesian dualism as a ‘category mistake’ and argued that mental vocabulary refers to patterns of behavior and dispositions, not to inner ghostly entities. He emphasized the analysis of ordinary language about mind, knowledge, and action to dissolve philosophical puzzles. His work contributed to behaviorist and anti-introspectivist approaches in philosophy of mind. He championed a style of clear, anti-metaphysical analysis characteristic of mid-20th-century Oxford philosophy.","Ryle was born in England and educated at Oxford, where he later taught and became a central figure in its philosophical community. He served in military intelligence during World War II and afterward edited the journal Mind. His career unfolded during the heyday of ordinary language philosophy, when British analytic philosophy was reacting against both idealism and overly formal approaches.",Philosophy of Mind;Philosophy of Language;Epistemology,Non-Cartesian; Logical Behaviorism; Anti-dualism,Conceptual Analysis; Attention to Ordinary Usage,No Systematic Normative Ethics,Liberal; Anti-authoritarian; Not Systematically Political,Raised in a Christian culture; Personally Non-religious,The Concept of Mind; Dilemmas; Essays in Philosophical Method,Category mistake;Ghost in the machine;Oxford philosophy
P047,1911,1960.0,Europe,Modern European,20th Century,Ordinary Language Philosophy;Speech Act Theory,"Austin developed speech act theory, distinguishing between locutionary, illocutionary, and perlocutionary aspects of utterances, thereby showing that to say something is often to do something. He argued that many philosophical confusions arise from ignoring the fine-grained uses of words in everyday contexts. His method involved careful consideration of linguistic nuances and examples to resolve traditional problems. His work significantly shaped philosophy of language and influenced linguistics and legal theory.","Austin was born in Lancaster, England, educated at Oxford, and spent much of his career there as a highly regarded teacher and interlocutor. During World War II he worked in British military intelligence, where his analytic skills contributed to planning and operations. In the postwar era, he led influential seminars that helped define ordinary language philosophy in the English-speaking world.",Philosophy of Language;Epistemology;Philosophy of Action,Anti-essentialist; Focus on Use and Context,Ordinary Language Analysis,No Systematic Normative Ethics,Generally Liberal; Not Systematically Political,Raised in Anglican context; Personally Non-religious,"How to Do Things with Words; Sense and Sensibilia (posthumous, based on lectures)",Speech acts;Ordinary language;Oxford analytic tradition
P048,1940,2022.0,North America,American,20th Century,Analytic Philosophy;Modal Logic,"Kripke revolutionized modal logic and metaphysics by introducing possible-world semantics and defending a robust account of necessity and possibility. In Naming and Necessity, he argued for rigid designators and necessary a posteriori truths, challenging descriptivist theories of reference. His work in the philosophy of language and mind influenced debates on identity, essence, and the semantics of proper names. He also contributed to set theory and interpretations of Wittgenstein on rules and meaning.","Born in Nebraska, Kripke showed prodigious mathematical and logical talent from a young age, publishing in modal logic while still a teenager. He studied at Harvard and held positions at institutions such as Rockefeller University and Princeton. Working in the latter half of the 20th century, he became a central figure in analytic metaphysics and philosophy of language, often lecturing rather than publishing extensively.",Logic;Metaphysics;Philosophy of Language;Philosophy of Mind,Modal Realism (in a semantic sense); Essentialism (modal),Rationalist-leaning Analytic Method; Formal Semantics,No Systematic Normative Ethics,Not Systematically Political,Jewish background; Non-theological in published work,Naming and Necessity; Semantical Considerations on Modal Logic; Wittgenstein on Rules and Private Language,Rigid designation;Necessary a posteriori;Modal logic
P049,1917,2003.0,North America,American,20th Century,Analytic Philosophy,"Davidson developed a truth-conditional theory of meaning, proposing that understanding a language involves a theory that assigns truth conditions to its sentences. He argued for the principle of charity in interpretation and a holistic view of belief and meaning. In philosophy of action, he analyzed the relation between reasons and causes, defending anomalous monism in the philosophy of mind, where mental events are identical with physical events but not governed by strict laws. His work connected philosophy of language, mind, and action in an influential unified framework.","Davidson was born in Massachusetts, studied and taught at Harvard, Stanford, Princeton, and Berkeley, and interacted with many leading analytic philosophers of his time. His career spanned mid- to late-20th-century American analytic philosophy, which increasingly integrated formal methods with concerns about meaning, mind, and action. He also drew on literature and psychoanalysis, reflecting a broad humanistic background.",Philosophy of Language;Philosophy of Mind;Philosophy of Action;Epistemology,Anomalous Monism; Physicalism with Irreducible Mental Properties,Truth-conditional Semantics; Holism; Principle of Charity,No Systematic Normative Ethics,Liberal; Not Systematically Political,Raised in a Protestant milieu; Personally Non-religious,"Actions, Reasons, and Causes; Truth and Meaning; Essays on Actions and Events",Anomalous monism;Radical interpretation;Truth-conditional semantics
P050,1902,1994.0,Europe,Modern European,20th Century,Critical Rationalism;Philosophy of Science,"Popper argued that scientific theories cannot be conclusively verified but can be rigorously tested and potentially falsified, making falsifiability the demarcation criterion for science. He criticized historicist and authoritarian ideologies, defending an open society in which institutions allow for critical scrutiny and piecemeal social engineering. In epistemology, he embraced fallibilism and conjectural knowledge, emphasizing bold hypotheses and critical refutation. His work influenced philosophy of science, political theory, and debates about rationality and democracy.","Popper was born in Vienna, influenced by the intellectual climate of the interwar period and the Vienna Circle, though he was critical of their verificationism. As fascism rose in Europe, he emigrated first to New Zealand and later to the United Kingdom, teaching at the London School of Economics. His experiences with totalitarian regimes and scientific debates informed his strong defense of critical rationalism and liberal democracy.",Philosophy of Science;Epistemology;Political Philosophy,Critical Rationalism; Realism about Science,Fallibilism; Hypothetico-Deductive Method,Critical Ethics; Piecemeal Social Engineering; Anti-Utopian,Liberal; Anti-totalitarian; Social Democratic Leanings,Jewish background; Secular; Agnostic,The Logic of Scientific Discovery; The Open Society and Its Enemies; Conjectures and Refutations; Objective Knowledge,Falsifiability;Open society;Critique of historicism
P051,1859,1938.0,Europe,Modern European,20th Century,Phenomenology,"Husserl founded phenomenology as a rigorous method for describing the structures of consciousness and the intentionality of experience. He proposed bracketing or suspending assumptions about the external world to focus on how objects are given in experience, aiming at essential insights into phenomena. His later work explored the lifeworld, intersubjectivity, and the crisis of European sciences, criticizing the neglect of the experiential basis of meaning. His ideas laid the groundwork for much of 20th-century continental philosophy, including existentialism and hermeneutics.","Husserl was born in Moravia (then part of the Austro-Hungarian Empire), studied mathematics and philosophy in Vienna and Berlin, and taught at Halle, Göttingen, and Freiburg. Initially influenced by psychologism, he turned against it and sought a more rigorous philosophical foundation. As a Jew in Germany during the rise of Nazism, he was marginalized and removed from his professorship, though his work continued to influence students and colleagues.",Epistemology;Metaphysics;Philosophy of Mind;Logic,Transcendental Idealism (Phenomenological); Intentionality-based,Phenomenology; Eidetic Intuition; Anti-psychologism,No Systematic Normative Ethics; Concern with Rationality and Lifeworld,Liberal; Not Systematically Political,Jewish background; Later Protestant conversion; Philosophical focus rather than theology,Logical Investigations; Ideas Pertaining to a Pure Phenomenology; Cartesian Meditations; The Crisis of European Sciences,Phenomenology founder;Intentionality;Lifeworld
